{
  "schemaVersion": "1.1.0",
  "id": "rel:nightly:2026-10-11:copilot-agent-sandbox-applies",
  "type": "Relationship",
  "from": "obs:nightly:2026-10-11:copilot-agent-sandbox",
  "predicate": "APPLIES_TO",
  "to": "qt314wink/seed-loom",
  "confidence": 0.8,
  "evidenceRefs": [
    "source:nightly:2026-10-11:copilot-agent-sandbox"
  ]
}
