{
  "schemaVersion": "1.1.0",
  "id": "rel:nightly:2026-09-16:1",
  "type": "Relationship",
  "from": "obs:nightly:2026-09-16:agent-control-plane",
  "predicate": "SUPPORTED_BY",
  "to": "source:nightly:2026-09-16:wso2",
  "confidence": 0.99,
  "evidenceRefs": [
    "source:nightly:2026-09-16:wso2",
    "source:nightly:2026-09-16:traefik"
  ]
}
