{
  "schemaVersion": "1.1.0",
  "id": "rel:nightly:2026-10-10:flock-surveillance-layoff-report-applies",
  "type": "Relationship",
  "from": "obs:nightly:2026-10-10:flock-surveillance-layoff-report",
  "predicate": "APPLIES_TO",
  "to": "qt314wink/seed-loom",
  "confidence": 0.76,
  "evidenceRefs": [
    "source:nightly:2026-10-10:flock-surveillance-layoff-report"
  ]
}
