{
  "schemaVersion": "1.1.0",
  "id": "rel:nightly:2026-09-15:4",
  "type": "Relationship",
  "from": "obs:nightly:2026-09-15:civic-ai-consulting-procurement",
  "predicate": "SUPPORTED_BY",
  "to": "source:usac:ai-consulting-rfp:2026-09-15",
  "confidence": 0.99,
  "evidenceRefs": [
    "source:usac:ai-consulting-rfp:2026-09-15"
  ]
}
