{
  "schemaVersion": "1.1.0",
  "id": "rel:nightly:2026-09-13:3",
  "type": "Relationship",
  "from": "obs:nightly:2026-09-13:common-species-decline",
  "predicate": "SUPPORTED_BY",
  "to": "source:nature:common-species-decline:2026-09-12",
  "confidence": 0.99,
  "evidenceRefs": [
    "source:nature:common-species-decline:2026-09-12"
  ],
  "validFrom": "2026-09-13T23:03:49Z",
  "validTo": null
}
